{
  "meta": {
    "slug": "protesta_solitaria",
    "titulo": "Protestar solo",
    "subtitulo": "El caso de Javier Ernesto Martín Gutiérrez, campeón cubano de MMA encarcelado tras nueve días de protesta pacífica frente a su casa, y el cargo de \"desórdenes públicos\" que el Estado cubano ha usado contra manifestantes solitarios entre 2024 y 2026.",
    "descripcion": "Javier Ernesto Martín Gutiérrez, conocido como \"Spiderman\" por su carrera como campeón cubano de artes marciales mixtas, permanece en prisión provisional en el Combinado del Este, la prisión de máxima seguridad de La Habana. Su caso arrancó el 24 de abril de 2026, cuando fue detenido tras protestar en solitario, día tras día, frente a su vivienda en el municipio de Marianao. Según las fuentes consultadas —14ymedio, Martí Noticias y CiberCuba— la protesta se extendió entre ocho y nueve días según la fuente, y denunciaba de forma explícita los apagones, la escasez y el deterioro de la vida cotidiana en Cuba.\n\nLo ocurrido tras la detención sigue un patrón que organizaciones de derechos humanos han documentado en otros casos: interceptación violenta por agentes vestidos de civil, un período sin información oficial sobre su paradero que el Instituto Cubano por la Libertad de Expresión y Prensa (ICLEP) calificó como indicador de desaparición forzada de corto plazo, y una retención inicial en Villa Marista, la sede de la Seguridad del Estado, bajo lo que las propias autoridades llamaron \"evaluación clínica\". En mayo de 2026 fue trasladado al Combinado del Este bajo la medida cautelar de prisión provisional.\n\nSe le acusa formalmente de \"desórdenes públicos\"; el segundo cargo, descrito en el envío original como \"incitación a delinquir\", no pudo confirmarse en esos términos exactos: las fuentes disponibles hablan de incitar o instigar a la población a protestar, una formulación cercana pero distinta a la figura penal de incitación a delinquir. Su abogado presentó una solicitud de cambio de medida cautelar y, después, un recurso de queja; ambos fueron rechazados por la fiscalía, lo que matiza —sin descartar— la afirmación de que careció por completo de defensa jurídica.\n\nEste expediente sitúa el caso de Martín junto a un patrón más amplio: el uso del cargo de \"desórdenes públicos\" contra manifestantes pacíficos individuales o de pequeño grupo en Cuba entre 2024 y 2026. Los casos de Manicaragua (Villa Clara, octubre de 2024, cuatro manifestantes condenados a cinco y seis años), Bayamo (Granma, marzo de 2024, protesta por apagones con condenas de hasta nueve años) y Santiago de Cuba (barrio El Carmen, noviembre de 2025, dos mujeres detenidas) muestran que el cargo se aplica de forma recurrente, con o sin visibilidad pública previa del acusado. Prisoners Defenders reportó 1.260 presos políticos en Cuba a abril de 2026; Diario de Cuba, usando una metodología distinta centrada solo en encarcelamiento efectivo, cifra en 820 los presos por razones políticas en el mismo período. Ninguna de las dos organizaciones desglosa públicamente cuántos de esos casos corresponden específicamente al cargo de desórdenes públicos.\n\nCada afirmación de este expediente conserva su fuente y su grado de verificación. Donde el envío original incluía una afirmación que no pudo cotejarse —el segundo cargo exacto, la ausencia total de defensa jurídica, la existencia de un examen médico oficial que descartara un trastorno— queda marcada visiblemente como no confirmada, nunca presentada como un hecho asentado.",
    "narracion": "Javier Ernesto Martín Gutiérrez, conocido como Spiderman, campeón cubano de artes marciales mixtas, permanece en prisión provisional en el Combinado del Este, la cárcel de máxima seguridad de La Habana. Fue detenido el veinticuatro de abril de dos mil veintiséis, tras protestar en solitario frente a su casa en Marianao durante ocho o nueve días según la fuente, denunciando los apagones y la escasez. Agentes vestidos de civil lo golpearon y lo retuvieron sin información oficial durante varias horas, un episodio que una organización de prensa calificó como desaparición forzada de corto plazo. Estuvo semanas bajo evaluación clínica en Villa Marista antes de ser trasladado, en mayo, al Combinado del Este. Se le acusa de desórdenes públicos; su abogado presentó dos recursos legales y ambos fueron rechazados. Este expediente compara su caso con otros tres, en Villa Clara, Santiago de Cuba y Granma, donde el mismo cargo llevó a condenas de hasta nueve años contra manifestantes sin ninguna visibilidad pública. Prisoners Defenders contó mil doscientos sesenta presos políticos en Cuba a abril de dos mil veintiséis. Cada dato conserva su fuente y su grado de verificación.",
    "version": "1.0.0",
    "fecha_datos": "2026-07-26",
    "advertencia": "El segundo cargo exacto contra Javier Ernesto Martín, el alcance real de su defensa jurídica y la existencia de un examen médico oficial que descartara un trastorno no pudieron confirmarse en esta pasada: aparecen marcados visiblemente como no confirmados, nunca como hechos asentados."
  },
  "intro": {
    "parrafos": [
      "El 24 de abril de 2026, Javier Ernesto Martín Gutiérrez, campeón cubano de artes marciales mixtas conocido como \"Spiderman\", fue interceptado y golpeado por agentes vestidos de civil tras nueve días protestando en solitario frente a su casa en Marianao. Hoy sigue en prisión provisional en el Combinado del Este, acusado de \"desórdenes públicos\".",
      "Su caso no es aislado. \"Desórdenes públicos\" es el cargo que el Estado cubano ha usado de forma recurrente entre 2024 y 2026 contra manifestantes pacíficos individuales o de pequeño grupo, con o sin visibilidad pública previa: desde cuatro personas condenadas a varios años en un pueblo de Villa Clara hasta un caso registrado en un barrio de Santiago de Cuba.",
      "Este expediente separa con cuidado dos niveles. El primero es el caso índice: los hechos concretos de Javier Martín, con su fuente y su grado de verificación marcados uno por uno. El segundo es el patrón: la evidencia, documentada por prensa independiente y por Prisoners Defenders, de que ese mismo cargo se repite contra otras personas. Ninguno de los dos niveles se presenta como si fuera el otro."
    ]
  },
  "caso_indice": {
    "advertencia": "Los hechos centrales de este caso —identidad, fecha y lugar de la protesta, golpiza, traslados y cargo de desórdenes públicos— están corroborados por prensa independiente. El segundo cargo exacto, la extensión de su defensa jurídica y el resultado de un examen médico oficial no pudieron confirmarse y quedan marcados como no confirmados.",
    "perfil": {
      "nombre": "Javier Ernesto Martín Gutiérrez",
      "alias": "\"Spiderman\"",
      "disciplina": "Artes marciales mixtas (MMA), campeón cubano",
      "lugar": "Marianao, La Habana"
    },
    "hechos": [
      {
        "afirmacion": "Protestó en solitario frente a su vivienda en Marianao durante ocho o nueve días (las fuentes difieren), denunciando los apagones, la escasez y la crisis económica y social del país.",
        "confianza": "corroborada",
        "fuente": "14ymedio, Martí Noticias, CiberCuba (abril de 2026)",
        "nota": "14ymedio reporta ocho días de protesta solitaria; otras fuentes cuentan nueve, desde el 19 hasta el 24 de abril."
      },
      {
        "afirmacion": "Fue interceptado y golpeado en la calle el 24 de abril de 2026 por agentes vestidos de civil.",
        "confianza": "corroborada",
        "fuente": "14ymedio (relato de su esposa, Lisandra Cuza)"
      },
      {
        "afirmacion": "Hubo un período sin información oficial sobre su paradero, que ICLEP documentó bajo indicadores de desaparición forzada de corto plazo: detención sin orden judicial ni identificación formal, sin notificación oficial a la familia.",
        "confianza": "corroborada",
        "fuente": "ICLEP"
      },
      {
        "afirmacion": "Estuvo retenido en Villa Marista, sede de la Seguridad del Estado, bajo lo que las propias autoridades calificaron como \"evaluación clínica\".",
        "confianza": "corroborada",
        "fuente": "Diario de Cuba, CiberCuba"
      },
      {
        "afirmacion": "En mayo de 2026 fue trasladado al Combinado del Este, prisión de máxima seguridad, bajo la medida cautelar de prisión provisional.",
        "confianza": "corroborada",
        "fuente": "14ymedio, Martí Noticias"
      },
      {
        "afirmacion": "Se le acusa formalmente de \"desórdenes públicos\".",
        "confianza": "corroborada",
        "fuente": "14ymedio, CiberCuba"
      },
      {
        "afirmacion": "El segundo cargo se reporta como \"incitar\" o \"instigar\" a la población a protestar, no como \"incitación a delinquir\" en sentido estricto.",
        "confianza": "no_confirmada",
        "fuente": "14ymedio, CiberCuba",
        "nota": "No se localizó fuente que use literalmente la fórmula \"incitación a delinquir\" para este caso específico."
      },
      {
        "afirmacion": "Su abogado presentó una solicitud de cambio de medida cautelar y, después, un recurso de queja; la fiscalía rechazó ambos.",
        "confianza": "corroborada",
        "fuente": "Diario de Cuba"
      },
      {
        "afirmacion": "Careció por completo de acceso a defensa jurídica efectiva.",
        "confianza": "no_confirmada",
        "fuente": "Diario de Cuba documenta lo contrario: tuvo abogado activo, con recursos denegados",
        "nota": "Se corrige a: tuvo defensa jurídica, pero sus recursos fueron sistemáticamente rechazados."
      },
      {
        "afirmacion": "Un examen médico oficial descartó un trastorno de salud mental atribuido a Martín por un perfil oficialista.",
        "confianza": "no_confirmada",
        "fuente": "Ninguna fuente localizada confirma un examen médico oficial con ese resultado",